{"backendType":"http","classification":"Across government services","description":"This is an example of a valid schema of a linked API that will be set to auto publish","displayName":"OT52-Linked API example draft metadata","environments":[{"Backends":null,"Subscriptions":null,"ApiId":0,"BackendMode":null,"BackendUrl":null,"BaseUrl":"https://valid-base-url.co.uk","CanSubscribe":false,"Enabled":false,"Index":0,"Name":"dev","RequiresApproval":false,"Status":null,"Visibility":"Inherit","Id":0},{"Backends":null,"Subscriptions":null,"ApiId":0,"BackendMode":null,"BackendUrl":null,"BaseUrl":"https://valid-base-url.co.uk","CanSubscribe":false,"Enabled":false,"Index":0,"Name":"staging","RequiresApproval":false,"Status":null,"Visibility":"Inherit","Id":0},{"Backends":null,"Subscriptions":null,"ApiId":0,"BackendMode":null,"BackendUrl":null,"BaseUrl":"https://valid-base-url.co.uk","CanSubscribe":false,"Enabled":false,"Index":0,"Name":"live","RequiresApproval":false,"Status":null,"Visibility":"Private","Id":0}],"majorVersion":"v1","overview":"This message will be presented to the users in the FaUAPI consumption portal","releases":null,"schemaType":null,"schemaUrl":null,"serviceLevel":"24/7","tags":"example;publish;api;","technology":"REST, C#","usage":"Government parties can use it","visibility":"Internal"}