{
    "displayName": "Linked API example publish",
    "description": "This is an example of a valid schema of a linked API that will be set to auto publish",
    "overview": "This message will be presented to the users in the FaUAPI consumption portal",
    "backendType": "http",
    "majorVersion": "v1",
    "visibility": "Internal",
    "tags": "example;publish;api;",
    "classification": "Across government services",
    "serviceLevel": "24/7",
    "technology": "REST, C#",
    "usage": "Government parties can use it",
    "environments": [
        {
            "name": "dev",
            "baseUrl" : "https://valid-base-url.co.uk",
            "visibility" : "Inherit"
        },
        {
            "name": "staging",
            "baseUrl" : "https://valid-base-url.co.uk",
            "visibility" : "Inherit"
        },
        {
            "name": "live",
            "baseUrl" : "https://valid-base-url.co.uk",
            "visibility" : "Private"
        }
    ]
}